2013-01-16,preconcert,To arrange in advance or beforehand, as by a previous agreement.,Preceding a concert: a preconcert reception for sponsors.,
2013-01-15,vertex,The highest point of something; apex; summit; top: the vertex of a mountain.,Anatomy, Zoology. The crown or top of the head.,Craniometry. The highest point on the midsagittal plane of the skull or head viewed from the left side when the skull or head is in the Frankfurt horizontal.,
2013-01-14,also-ran,Informal. A person who loses a contest, election, or other competition.,Sports. A. (In a race) a contestant who fails to win or to place among the first three finishers. B. An athlete or team whose performance in competition is rarely, if ever, a winning or near-winning one.,Informal. A person who attains little or no success: For every great artist there are a thousand also-rans.,
2013-01-13,eurhythmic,Characterized by a pleasing rhythm; harmoniously ordered or proportioned.,Of or pertaining to eurhythmics.,
2013-01-12,filch,To steal (especially something of small value); pilfer: to filch ashtrays from fancy restaurants.,
2013-01-11,pseudepigraphy,The false ascription of a piece of writing to an author.,
2013-01-10,pseudoclassic,Falsely or spuriously classic.,Imitating the classic: the pseudoclassic style of some modern authors.,
2013-01-09,pseudomorph,An irregular or unclassifiable form.,A mineral having the outward appearance of another mineral that it has replaced by chemical action.,
2013-01-08,pseudology,Lying considered as an art.,
2013-01-07,pseudonymous,Bearing a false or fictitious name.,Writing or written under a fictitious name.,
2013-01-06,birl,To spin or cause to rotate.,Chiefly Northern U.S. Lumbering. To cause (a floating log) to rotate rapidly by treading upon it.,British. A. To move or rotate rapidly. B. Informal. To spend money freely. C. Informal. To gamble.,
2013-01-05,aumildar,A manager or agent.,A collector of revenue.,
2013-01-04,couthie,Agreeable; genial; kindly.,
2013-01-03,violescent,Tending to a violet color: a violescent twilight sky.,
2013-01-02,advert,To remark or comment; refer (usually followed by to): He adverted briefly to the news of the day.,To turn the attention (usually followed by to): The committee adverted to the business at hand.,
2013-01-01,exordium,The beginning of anything.,The introductory part of an oration, treatise, etc.,
