2013-07-01,muster,to gather, summon, rouse (often followed by up): He mustered all his courage.,to assemble (troops, a ship's crew, etc.), as for battle, display, inspection, orders, or discharge.,to assemble for inspection, service, etc., as troops or forces.,
2013-06-30,scrum,a Rugby play in which, typically, three members of each team line up opposite one another with a group of two and a group of three players behind them, making an eight-person, three-two-three formation on each side; the ball is then rolled between the opposing front lines, the players of which stand with arms around a teammate's waist, meeting the opponent shoulder to shoulder, and attempt to kick the ball backward to a teammate.,British. a place or situation of confusion and racket; hubbub.,to engage in a scrum.,
2013-06-29,vilify,to speak ill of; defame; slander.,Obsolete. to make vile.,
2013-06-28,mickle,Archaic. great; large; much.,
2013-06-27,lese majesty,Law. a. a crime, especially high treason, committed against the sovereign power. b. an offense that violates the dignity of a ruler.,an attack on any custom, institution, belief, etc., held sacred or revered by numbers of people: Her speech against Mother's Day was criticized as lese majesty.,
2013-06-26,snood,a netlike hat or part of a hat or fabric that holds or covers the back of a woman's hair.,a headband for the hair.,the distinctive headband formerly worn by young unmarried women in Scotland and northern England.,
2013-06-25,dilly,Informal. something or someone regarded as remarkable, unusual, etc.: a dilly of a movie.,
2013-06-24,asyndeton,Rhetoric. the omission of conjunctions, as in “He has provided the poor with jobs, with opportunity, with self-respect.”,Library Science. the omission of cross references, especially from a catalog.,
2013-06-23,drawl,to say or speak in a slow manner, usually prolonging the vowels.,an act or utterance of a person who drawls.,
2013-06-22,fen,low land covered wholly or partially with water; boggy land; a marsh.,the Fens, a marshy region W and S of The Wash, in E England.,
2013-06-21,poniard,a small, slender dagger.,to stab with a poniard.,
2013-06-20,hamlet,a small village.,British. a village without a church of its own, belonging to the parish of another village or town.,
2013-06-19,balk,to stop, as at an obstacle, and refuse to proceed or to do something specified (usually followed by at): He balked at making the speech.,(of a horse, mule, etc.) to stop short and stubbornly refuse to go on.,to place an obstacle in the way of; hinder; thwart: a sudden reversal that balked her hopes.,
2013-06-18,falcate,curved like a scythe or sickle; hooked; falciform.,
2013-06-17,phosphoresce,to be luminous without sensible heat, as phosphorus.,
2013-06-16,mishpocha,an entire family network comprising relatives by blood and marriage and sometimes including close friends; clan.,
2013-06-15,palinode,a poem in which the poet retracts something said in an earlier poem.,a recantation.,
2013-06-14,diglossia,the widespread existence within a society of sharply divergent formal and informal varieties of a language each used in different social contexts or for performing different functions, as the existence of Katharevusa and Demotic in modern Greece.,Pathology. the presence of two tongues or of a single tongue divided into two parts by a cleft.,
2013-06-13,xanthic,of or pertaining to a yellow or yellowish color.,Chemistry. of or derived from xanthine or xanthic acid.,
2013-06-12,sward,the grassy surface of land; turf.,a stretch of turf; a growth of grass.,to cover with sward or turf.,
2013-06-11,spelunk,to explore caves, especially as a hobby.,
2013-06-10,codger,an eccentric man, especially one who is old.,
2013-06-09,wonk,a stupid, boring, or unattractive person.,a student who spends much time studying and has little or no social life; grind.,a person who studies a subject or issue in an excessively assiduous and thorough manner: a policy wonk.,
2013-06-08,trousseau,an outfit of clothing, household linen, etc., for a bride.,
2013-06-07,abdicate,to give up or renounce (authority, duties, an office, etc.), especially in a voluntary, public, or formal manner: King Edward VIII of England abdicated the throne in 1936.,to renounce or relinquish a throne, right, power, claim, responsibility, or the like, especially in a formal manner: The aging founder of the firm decided to abdicate.,
2013-06-06,trachle,an exhausting effort, especially walking or working.,an exhausted or bedraggled person.,to fatigue; tire; wear out.,
2013-06-05,hadal,of or pertaining to the greatest ocean depths, below approximately 20,000 feet (6500 meters).,of or pertaining to the biogeographic region of the ocean bottom below the abyssal zone.,
2013-06-04,zither,a musical instrument, consisting of a flat sounding box with numerous strings stretched over it, that is placed on a horizontal surface and played with a plectrum and the fingertips.,
2013-06-03,automaton,a mechanical figure or contrivance constructed to act as if by its own motive power; robot.,a person or animal that acts in a monotonous, routine manner, without active intelligence.,something capable of acting automatically or without an external motive force.,
2013-06-02,lunker,something unusually large for its kind.,Angling. a very large game fish, especially a bass.,
2013-06-01,ken,knowledge, understanding, or cognizance; mental perception: an idea beyond one's ken.,range of sight or vision.,Chiefly Scot. a. to know, have knowledge of or about, or be acquainted with (a person or thing). b. to understand or perceive (an idea or situation).,
2013-05-31,de profundis,out of the depths (of sorrow, despair, etc.).,
2013-05-30,wuther,(of wind) to blow fiercely.,
2013-05-29,battology,wearisome repetition of words in speaking or writing.,
2013-05-28,isolato,a person who is spiritually isolated from or out of sympathy with his or her times or society.,
2013-05-27,mordacious,sharp or caustic in style, tone, etc.,biting or given to biting.,
2013-05-26,topos,a convention or motif, especially in a literary work; a rhetorical convention.,
2013-05-25,blather,to talk or utter foolishly; blither; babble: The poor thing blathered for hours about the intricacies of his psyche.,foolish, voluble talk: His speech was full of the most amazing blather.,
2013-05-24,skeuomorph,an ornament or design on an object copied from a form of the object when made from another material or by other techniques, as an imitation metal rivet mark found on handles of prehistoric pottery.,
2013-05-23,genethliac,of or pertaining to birthdays or to the position of the stars at one's birth.,
2013-05-22,theurgy,the working of a divine or supernatural agency in human affairs.,a system of beneficent magic practiced by the Egyptian Platonists and others.,
2013-05-21,pasquinade,a satire or lampoon, especially one posted in a public place.,to assail in a pasquinade or pasquinades.,
2013-05-20,coalesce,to blend or come together: Their ideas coalesced into one theory.,to grow together or into one body: The two lakes coalesced into one.,to unite so as to form one mass, community, etc.: The various groups coalesced into a crowd.,
2013-05-19,darg,Scot. and North England. a day's work.,Australian. a fixed or definite amount of work; a work quota.,
2013-05-18,consortium,any association, partnership, or union.,a combination of financial institutions, capitalists, etc., for carrying into effect some financial operation requiring large resources of capital.,Law. the legal right of husband and wife to companionship and conjugal intercourse with each other: In a wrongful death action the surviving spouse commonly seeks damages for loss of consortium.,
2013-05-17,motza,a large amount of money, especially a sum won in gambling.,
2013-05-16,allochthonous,not formed in the region where found.,
2013-05-15,circadian,noting or pertaining to rhythmic biological cycles recurring at approximately 24-hour intervals.,
2013-05-14,quacksalver,a charlatan.,a quack doctor.,
2013-05-13,melliferous,yielding or producing honey.,
2013-05-12,feminacy,feminine nature.,
2013-05-11,snafu,a badly confused or ridiculously muddled situation: A ballot snafu in the election led to a recount.,Rare. in disorder; out of control; chaotic: a snafu scheme that simply won't work.,Rare. to throw into disorder; muddle: Losing his passport snafued the whole vacation.,
2013-05-10,aeolian,(usually lowercase) of or caused by the wind; wind-blown.,pertaining to Aeolus,  or to the winds in general.,
2013-05-09,whangdoodle,a fanciful creature of undefined nature.,
2013-05-08,dais,a raised platform, as at the front of a room, for a lectern, throne, seats of honor, etc.,
2013-05-07,logomachy,a dispute about or concerning words.,an argument or debate marked by the reckless or incorrect use of words; meaningless battle of words.,a game played with cards, each bearing one letter, with which words are formed.,
2013-05-06,spang,directly, exactly: The bullet landed spang on target.,
2013-05-05,quibble,to equivocate.,to carp; cavil.,an instance of the use of ambiguous, prevaricating, or irrelevant language or arguments to evade a point at issue.,
2013-05-04,droll,amusing in an odd way; whimsically humorous; waggish.,a droll person; jester; wag.,Archaic. to jest; joke.,
2013-05-03,ratiocination,the process of logical reasoning.,
2013-05-02,saccharine,exaggeratedly sweet or sentimental: a saccharine smile; a saccharine song of undying love.,of the nature of or resembling that of sugar: a powdery substance with a saccharine taste.,containing or yielding sugar.,
2013-05-01,polliwog,a tadpole.,
2013-04-30,cull,to choose; select; pick.,to gather the choice things or parts from.,to collect; gather; pluck.,
2013-04-29,hellion,a disorderly, troublesome, rowdy, or mischievous person.,
2013-04-28,stark,extremely simple or severe: a stark interior.,sheer, utter, downright, or complete: stark madness.,harsh, grim, or desolate, as a view, place, etc.: a stark landscape.,
2013-04-27,aleatory,of or pertaining to accidental causes; of luck or chance; unpredictable: an aleatory element.,Law. depending on a contingent event: an aleatory contract.,Music. employing the element of chance in the choice of tones, rests, durations, rhythms, dynamics, etc.,
2013-04-26,gopher,Mining. a. to mine unsystematically. b. to enlarge a hole, as in loose soil, with successively larger blasts.,any of several ground squirrels of the genus Citellus, of the prairie regions of North America.,pocket gopher.,
2013-04-25,flounder,to struggle clumsily or helplessly: He floundered helplessly on the first day of his new job.,to struggle with stumbling or plunging movements (usually followed by about, along, on, through, etc.): He saw the child floundering about in the water.,
2013-04-24,porpoise,to move forward with a rising and falling motion.,(of a speeding motorboat) to leap clear of the water after striking a wave.,(of a torpedo) to appear above the surface of the water.,
2013-04-23,gander,Slang. a look: Take a gander at his new shoes.,the male of the goose. Compare goose (def. 2).,
2013-04-22,crawfish,Informal. to back out or retreat from a position or undertaking.,crayfish.,
2013-04-21,quoin,one of the stones forming an external wall; cornerstone.,an external solid angle of a wall or the like.,any of various bricks of standard shape for forming corners of brick walls or the like.,
2013-04-20,soigné,carefully or elegantly done, operated, or designed.,well-groomed.,
2013-04-19,cornice,a mass of snow, ice, etc., projecting over a mountain ridge.,Architecture. a. any prominent, continuous, horizontally projecting feature surmounting a wall or other construction, or dividing it horizontally for compositional purposes. b. the uppermost member of a classical entablature, consisting of a bed molding, a corona, and a cymatium, with rows of dentils, modillions, etc., often placed between the bed molding and the corona.,any of various other ornamental horizontal moldings or bands, as for concealing hooks or rods from which curtains are hung or for supporting picture hooks.,
2013-04-18,decamp,to depart quickly, secretly, or unceremoniously: The band of thieves decamped in the night.,to depart from a camp; to pack up equipment and leave a camping ground: We decamped before the rain began.,
2013-04-17,bandbox,an area or structure that is smaller in dimensions or size than the standard: It's easy to hit home runs out of this bandbox.,a lightweight box of pasteboard, thin wood, etc., for holding a hat, clerical collars, or other articles of apparel.,
2013-04-16,verisimilitude,the appearance or semblance of truth; likelihood; probability: The play lacked verisimilitude.,something, as an assertion, having merely the appearance of truth.,
2013-04-15,quell,to suppress; put an end to; extinguish: The troops quelled the rebellion quickly.,to vanquish; subdue.,to quiet or allay (emotions, anxieties, etc.): The child's mother quelled his fears of the thunder.,
2013-04-14,chuffed,annoyed; displeased; disgruntled.,delighted; pleased; satisfied.,
2013-04-13,imprest,an advance of money; loan.,
2013-04-12,percipient,having perception; discerning; discriminating: a percipient choice of wines.,perceiving or capable of perceiving.,a person or thing that perceives.,
2013-04-11,lilt,rhythmic swing or cadence.,a lilting song or tune.,to sing or play in a light, tripping, or rhythmic manner.,
2013-04-10,ingress,the act of going in or entering.,the right to enter.,a means or place of entering; entryway.,
2013-04-09,machinate,to contrive or plot, especially artfully or with evil purpose: to machinate the overthrow of the government.,
2013-04-08,plethoric,overfull; turgid; inflated: a plethoric, pompous speech.,of, pertaining to, or characterized by plethora.,
2013-04-07,demimonde,a group characterized by lack of success or status: the literary demimonde.,(especially during the last half of the 19th century) a class of women who have lost their standing in respectable society because of indiscreet behavior or sexual promiscuity.,a demimondaine.,
2013-04-06,idiolect,a person's individual speech pattern. Compare dialect (def. 1).,
2013-04-05,codicil,any supplement; appendix.,a supplement to a will, containing an addition, explanation, modification, etc., of something in the will.,
2013-04-04,ingratiate,to establish (oneself) in the favor or good graces of others, especially by deliberate effort (usually followed by with): He ingratiated himself with all the guests.,
2013-04-03,aperture,an opening, as a hole, slit, crack, gap, etc.,Also called <b>aperture stop</b>. Optics. an opening, usually circular, that limits the quantity of light that can enter an optical instrument.,
2013-04-02,splenetic,irritable; peevish; spiteful.,of the spleen; splenic.,Obsolete. affected with, characterized by, or tending to produce melancholy.,
2013-04-01,ha-ha,sunk fence.,
2013-03-31,impawn,to put in pawn; pledge.,
2013-03-30,gaumless,lacking in vitality or intelligence; stupid, dull, or clumsy.,
2013-03-29,swivet,a state of nervous excitement, haste, or anxiety; flutter: I was in such a swivet that I could hardly speak.,
2013-03-28,pharaonic,(usually lowercase) impressively or overwhelmingly large, luxurious, etc.: a construction project of pharaonic proportions.,(sometimes lowercase) of or like a Pharaoh: living in Pharaonic splendor.,(lowercase) cruelly oppressive; tyrannical: pharaonic tax laws.,
2013-03-27,tranche,any part, division, or installment: We've hired the first tranche of researchers.,Finance. a. one part or division of a larger unit, as of an asset pool or investment: The loan will be repaid in three tranches. b. a group of securities that share a certain characteristic and form part of a larger offering: The second tranche of the bond issue has a five-year maturity.,Finance. to divide into parts: tranched debt; A credit portfolio can be tranched into a variety of components that are then further subdivided.,
2013-03-26,wrest,to take away by force: to wrest a knife from a child.,to twist or turn; pull, jerk, or force by a violent twist.,to get by effort: to wrest a living from the soil.,
2013-03-25,marmoreal,of or like marble: skin of marmoreal smoothness.,
2013-03-24,daven,to pray.,
2013-03-23,preterition,the act of passing by or over; omission; disregard.,Law. the passing over by a testator of an heir otherwise entitled to a portion.,Calvinistic Theology. the passing over by God of those not elected to salvation or eternal life.,
2013-03-22,serpentine,having a winding course, as a road; sinuous.,of, characteristic of, or resembling a serpent, as in form or movement.,shrewd, wily, or cunning.,
2013-03-21,insouciance,the quality of being insouciant; lack of care or concern; indifference.,
2013-03-20,primaveral,of, in, or pertaining to the early springtime: primaveral longings to sail around the world.,
2013-03-19,hypothecate,to pledge to a creditor as security without delivering over; mortgage.,to put in pledge by delivery, as stocks given as security for a loan.,
2013-03-18,qualm,an uneasy feeling or pang of conscience as to conduct; compunction: He has no qualms about lying.,a sudden feeling of apprehensive uneasiness; misgiving: a sudden qualm about the success of the venture.,a sudden sensation or onset of faintness or illness, especially of nausea.,
2013-03-17,sundry,various or diverse: sundry persons.,
2013-03-16,prolepsis,Rhetoric. the anticipation of possible objections in order to answer them in advance.,the assigning of a person, event, etc., to a period earlier than the actual one; the representation of something in the future as if it already existed or had occurred; prochronism.,the use of a descriptive word in anticipation of its becoming applicable.,
2013-03-15,furl,to gather into a compact roll and bind securely, as a sail against a spar or a flag against its staff.,to become furled.,the act of furling.,
2013-03-14,madcap,wildly or heedlessly impulsive; reckless; rash: a madcap scheme.,a madcap person.,
2013-03-13,truant,a person who shirks or neglects his or her duty.,a student who stays away from school without permission.,absent from school without permission.,
2013-03-12,bevel,irresolutely.,the inclination that one line or surface makes with another when not at right angles.,a surface that does not form a right angle with adjacent surfaces.,
2013-03-11,shilly-shally,to show indecision or hesitation; be irresolute; vacillate.,to waste time; dawdle.,irresolution; indecision; vacillation: It was sheer shilly-shally on his part.,
2013-03-10,haberdashery,a retail shop dealing in men's furnishings, as shirts, ties, gloves, socks, and hats.,the goods sold there.,
2013-03-09,linchpin,something that holds the various elements of a complicated structure together: The monarchy was the linchpin of the nation's traditions and society.,a pin inserted through the end of an axletree to keep the wheel on.,
2013-03-08,scupper,Informal. to prevent from happening or succeeding; ruin; wreck.,Military. to overwhelm; surprise and destroy, disable, or massacre.,
2013-03-07,tertiary,of the third order, rank, stage, formation, etc.; third.,Chemistry. A. noting or containing a carbon atom united to three other carbon atoms. B. formed by replacement of three atoms or groups.,(initial capital letter) Geology. noting or pertaining to the period forming the earlier part of the Cenozoic Era, occurring from 65 million to 2 million years ago, characterized by the development and proliferation of mammals.,
2013-03-06,rialto,an exchange or mart.,
2013-03-05,indite,to compose or write, as a poem.,to treat in a literary composition.,Obsolete. to dictate.,
2013-03-04,bibelot,a small object of curiosity, beauty, or rarity.,
2013-03-03,panoptic,permitting the viewing of all parts or elements: a panoptic stain used in microscopy; a panoptic aerial photograph of an enemy missile base.,considering all parts or elements; all inclusive: a panoptic criticism of modern poetry.,
2013-03-02,mazuma,money.,
2013-03-01,leeward,pertaining to, situated in, or moving toward the quarter toward which the wind blows (opposed to windward).,the lee side; the point or quarter toward which the wind blows.,toward the lee.,
2013-02-28,ziggurat,(among the ancient Babylonians and Assyrians) a temple of Sumerian origin in the form of a pyramidal tower, consisting of a number of stories and having about the outside a broad ascent winding round the structure, presenting the appearance of a series of terraces.,
2013-02-27,zephyrean,of, pertaining to, or like a zephyr; full of or containing light breezes.,
2013-02-26,zakuska,an hors d'oeuvre.,
2013-02-25,yare,quick; agile; lively.,(of a ship) quick to the helm; easily handled or maneuvered.,Archaic. a. ready; prepared. b. nimble; quick.,
2013-02-24,xeric,of, pertaining to, or adapted to a dry environment.,
2013-02-23,whipsaw,to subject to two opposing forces at the same time: The real-estate market has been whipsawed by high interest rates and unemployment.,to cut with a whipsaw.,to win two bets from (a person) at one turn or play, as at faro.,
2013-02-22,varia,miscellaneous items, especially a miscellany of literary works.,
2013-02-21,umber,North England Dialect. shade; shadow.,an earth consisting chiefly of a hydrated oxide of iron and some oxide of manganese, used in its natural state as a brown pigment (raw umber) or, after heating, as a reddish-brown pigment (burnt umber).,the color of such a pigment; dark dusky brown or dark reddish brown.,
2013-02-20,tensile,capable of being stretched or drawn out; ductile.,of or pertaining to tension: tensile strain.,
2013-02-19,satrap,a subordinate ruler, often a despotic one.,a governor of a province under the ancient Persian monarchy.,
2013-02-18,recant,to withdraw or disavow (a statement, opinion, etc.), especially formally; retract.,to withdraw or disavow a statement, opinion, etc., especially formally.,
2013-02-17,quittance,recompense or requital.,discharge from a debt or obligation.,a document certifying discharge from debt or obligation, as a receipt.,
2013-02-16,paraph,a flourish made after a signature, as in a document, originally as a precaution against forgery.,
2013-02-15,obnubilate,to cloud over; becloud; obscure.,
2013-02-14,nuque,the back of the neck.,
2013-02-13,mainour,a stolen article found on the person of or near the thief: to be taken with the mainour.,
2013-02-12,lollapalooza,an extraordinary or unusual thing, person, or event; an exceptional example or instance.,
2013-02-11,kinchin,a child.,
2013-02-10,Jacobin,an extreme radical, especially in politics.,(in the French Revolution) a member of a radical society or club of revolutionaries that promoted the Reign of Terror and other extreme measures, active chiefly from 1789 to 1794: so called from the Dominican convent in Paris, where they originally met.,a Dominican friar.,
2013-02-09,irrefrangible,not to be broken or violated; inviolable: an irrefrangible rule of etiquette. ,incapable of being refracted.,
2013-02-08,hent,to seize.,
2013-02-07,gastronomy,the art or science of good eating.,a style of cooking or eating.,
2013-02-06,feuilleton,a part of a European newspaper devoted to light literature, fiction, criticism, etc.,an item printed in the feuilleton.,
2013-02-05,epexegesis,the addition of a word or words to explain a preceding word or sentence.,the word or words so added.,
2013-02-04,dyslogistic,conveying disapproval or censure; not complimentary or eulogistic.,
2013-02-03,counterfactual,a conditional statement the first clause of which expresses something contrary to fact, as “If I had known.”,
2013-02-02,boustrophedon,an ancient method of writing in which the lines run alternately from right to left and from left to right.,
2013-02-01,atavistic,of, pertaining to, or characterized by atavism; reverting to or suggesting the characteristics of a remote ancestor or primitive type.,
2013-01-31,jackanapes,An impertinent, presumptuous person, especially a young man; whippersnapper.,An impudent, mischievous child.,Archaic. An ape or monkey.,
2013-01-30,wellaway,(Used to express sorrow.),
2013-01-29,plotz,To collapse or faint, as from surprise, excitement, or exhaustion.,
2013-01-28,word-hoard,A person's vocabulary.,
2013-01-27,intemerate,Inviolate; undefiled; unsullied; pure.,
2013-01-26,antipathetic,Opposed, averse, or contrary; having or showing antipathy: They were antipathetic to many of the proposed changes .,Causing or likely to cause antipathy: The new management was antipathetic to all of us.,
2013-01-25,brabble,To argue stubbornly about trifles; wrangle.,Noisy, quarrelsome chatter.,
2013-01-24,kibitzer,A giver of uninvited or unwanted advice.,A spectator at a card game who looks at the players' cards over their shoulders, especially one who gives unsolicited advice.,A person who jokes, chitchats, or makes wisecracks, especially while others are trying to work or to discuss something seriously.,
2013-01-23,en règle,In order; according to the rules; correct.,
2013-01-22,gorgonize,To affect as a Gorgon; hypnotize; petrify.,
2013-01-21,allocution,A formal speech, especially one of an incontrovertible or hortatory nature.,A pronouncement delivered by the pope to a secret consistory, especially on a matter of policy or of general importance.,
2013-01-20,jubilarian,A person who celebrates or has celebrated a jubilee, as a nun observing 25 or more years of religious life.,
2013-01-19,shindy,A row; rumpus.,A shindig.,
2013-01-18,Camelot,Any idyllic place or period, especially one of great happiness.,The legendary site of King Arthur's palace and court, possibly near Exeter, England.,The glamorous ambience of Washington, D.C., during the administration of President John F. Kennedy, 1961–63.,
2013-01-17,hypnopompic,Of or pertaining to the semiconscious state prior to complete wakefulness.,
