2013-12-31,sozzled,Slang. drunk; inebriated.,
2013-12-30,Yarborough,Whist, Bridge. a hand in which no card is higher than a nine.,
2013-12-29,oeillade,an amorous glance; ogle.,
2013-12-28,hibernaculum,a protective case or covering, especially for winter, as of an animal or a plant bud.,winter quarters, as of a hibernating animal.,
2013-12-27,quadrille,a square dance for four couples, consisting of five parts or movements, each complete in itself.,the music for such a dance.,
2013-12-26,schmaltz,Informal. exaggerated sentimentalism, as in music or soap operas.,fat or grease, especially of a chicken.,
2013-12-25,advent,a coming into place, view, or being; arrival: the advent of the holiday season.,(usually initial capital letter) the coming of Christ into the world.,(initial capital letter) the period beginning four Sundays before Christmas, observed in commemoration of the coming of Christ into the world.,
2013-12-24,jigger,a person or thing that jigs.,Nautical. a. the lowermost sail set on a jiggermast. b. jiggermast. c. a light tackle, as a gun tackle.,any of various mechanical devices, many of which have a jerky or jolting motion.,
2013-12-23,parageusia,an abnormal or hallucinatory sense of taste.,
2013-12-22,fiddlesticks,(used to express impatience, dismissal, etc.),
2013-12-21,solstice,Astronomy. a. either of the two times a year when the sun is at its greatest distance from the celestial equator: about June 21, when the sun reaches its northernmost point on the celestial sphere, or about December 22, when it reaches its southernmost point. Compare summer solstice, winter solstice. b. either of the two points in the ecliptic farthest from the equator.,a furthest or culminating point; a turning point.,
2013-12-20,poultice,a soft, moist mass of cloth, bread, meal, herbs, etc., applied hot as a medicament to the body.,to apply a poultice to.,
2013-12-19,ambulate,to walk about or move from place to place.,
2013-12-18,transpontine,across or beyond a bridge.,on the southern side of the Thames in London.,
2013-12-17,cathexis,Psychoanalysis. the investment of emotional significance in an activity, object, or idea.,Psychoanalysis. the charge of psychic energy so invested.,
2013-12-16,klaxon,a loud electric horn, formerly used on automobiles, trucks, etc., and now often used as a warning signal.,
2013-12-15,misoneism,hatred or dislike of what is new or represents change.,
2013-12-14,whitherward,Archaic. toward what place; in what direction.,
2013-12-13,umbriferous,casting or making shade.,
2013-12-12,lipogram,a written work composed of words chosen so as to avoid the use of one or more specific alphabetic characters.,
2013-12-11,cusp,a point or pointed end.,Anatomy, Zoology, Botany. a point, projection, or elevation, as on the crown of a tooth.,Also called spinode. Geometry. a point where two branches of a curve meet, end, and are tangent.,
2013-12-10,ochlophobia,Psychiatry. an abnormal fear of crowds.,
2013-12-09,calorifacient,(of foods) producing heat.,
2013-12-08,hardihood,boldness or daring; courage.,audacity or impudence.,strength; power; vigor: the hardihood of youth.,
2013-12-07,jocose,given to or characterized by joking; jesting; humorous; playful: a jocose and amusing manner.,
2013-12-06,abiogenesis,Biology. the theory that living organisms can arise spontaneously from inanimate matter; spontaneous generation.,
2013-12-05,slumgullion,a stew of meat, vegetables, potatoes, etc.,a beverage made weak or thin, as watery tea, coffee, or the like.,the refuse from processing whale carcasses.,
2013-12-04,largesse,generous bestowal of gifts.,the gift or gifts, as of money, so bestowed.,Obsolete. generosity; liberality.,
2013-12-03,pokelogan,Northeastern U.S. marshy or stagnant water that has branched off from a stream or lake.,
2013-12-02,twain,two.,
2013-12-01,pilcrow,a paragraph mark.,
2013-11-30,suppletory,supplying a deficiency.,
2013-11-29,wight,active; nimble.,strong and brave, especially in war.,a human being.,
2013-11-28,borborygmus,a rumbling or gurgling sound caused by the movement of gas in the intestines.,
2013-11-27,gelt,Slang. money.,
2013-11-26,wroth,stormy; violent; turbulent: the wroth sea.,angry; wrathful (usually used predicatively): He was wroth to see the damage to his home.,
2013-11-25,decant,to pour (a liquid) from one container to another.,to pour (wine or other liquid) gently so as not to disturb the sediment.,
2013-11-24,za-zen,meditation in a prescribed, cross-legged posture.,
2013-11-23,tenuity,thinness of consistency; rarefied condition.,the state of being tenuous.,slenderness.,
2013-11-22,protoplast,Biology. a. the contents of a cell within the cell membrane, considered as a fundamental entity. b. the primordial living unit or cell.,a person or thing that is formed first; original; prototype.,the hypothetical first individual or one of the supposed first pair of a species or the like.,
2013-11-21,snarky,testy or irritable; short.,
2013-11-20,irredentist,a member of a party in any country advocating the acquisition of some region included in another country by reason of cultural, historical, ethnic, racial, or other ties.,(usually initial capital letter) a member of an Italian association that became prominent in 1878, advocating the redemption, or the incorporation into Italy, of certain neighboring regions (Italia irredenta) having a primarily Italian population.,pertaining to or supporting such a party or its doctrine.,
2013-11-19,omnium-gatherum,a miscellaneous collection.,
2013-11-18,commix,to mix together; blend.,
2013-11-17,antitype,something that is foreshadowed by a type or symbol, as a New Testament event prefigured in the Old Testament.,
2013-11-16,con amore,(italics) Italian. with love, tender enthusiasm, or zeal.,tenderly and lovingly (used as a musical direction).,
2013-11-15,maugre,in spite of; notwithstanding.,
2013-11-14,commissure,a joint; seam; suture.,Botany. the joint or face by which one carpel coheres with another.,Anatomy, Zoology. a connecting band of nerve fiber, especially one joining the right and left sides of the brain or spinal cord.,
2013-11-13,subjoin,to add at the end, as of something said or written; append.,to place in sequence or juxtaposition to something else.,
2013-11-12,diathesis,Pathology. a constitutional predisposition or tendency, as to a particular disease or affection.,
2013-11-11,roger,Informal. all right; O.K.,message received and understood (a response to radio communications).,(often initial capital letter) Jolly Roger.,
2013-11-10,mufti,civilian clothes, in contrast with military or other uniforms, or as worn by a person who usually wears a uniform.,a Muslim jurist expert in the religious law.,(in the Ottoman Empire) a deputy of the chief Muslim legal adviser to the Sultan.,
2013-11-09,en bloc,French. as a whole.,
2013-11-08,novitiate,the state or period of being a beginner in anything.,the state or period of being a novice of a religious order or congregation.,the quarters occupied by religious novices during probation.,
2013-11-07,clepe,Archaic. to call; name (now chiefly in the past participle as ycleped or yclept).,
2013-11-06,adscititious,added or derived from an external source; additional.,
2013-11-05,pol,a politician, especially one experienced in making political deals, exchanging political favors, etc.,
2013-11-04,skeigh,proudly.,(of horses) spirited; inclined to shy.,(of women) proud; disdainful.,
2013-11-03,vexatious,causing vexation; troublesome; annoying: a vexatious situation.,Law. (of legal actions) instituted without sufficient grounds and serving only to cause annoyance to the defendant.,disorderly; confused; troubled.,
2013-11-02,counterpoise,to balance by an opposing weight; counteract by an opposing force.,to bring into equilibrium.,Archaic. to weigh (one thing) against something else; consider carefully.,
2013-11-01,animalcule,a minute or microscopic animal, nearly or quite invisible to the naked eye, as an infusorian or rotifer.,Archaic. a tiny animal, as a mouse or fly.,
2013-10-31,phantasmagoric,having a fantastic or deceptive appearance, as something in a dream or created by the imagination.,having the appearance of an optical illusion, especially one produced by a magic lantern.,changing or shifting, as a scene made up of many elements.,
2013-10-30,obsequy,a funeral rite or ceremony.,
2013-10-29,crepuscule,twilight; dusk.,
2013-10-28,somnambulism,sleepwalking.,
2013-10-27,phrenology,a psychological theory or analytical method based on the belief that certain mental faculties and character traits are indicated by the configurations of the skull.,
2013-10-26,kelpie,(in Scottish legends) a water spirit, usually having the form of a horse, reputed to cause drownings or to warn those in danger of drowning.,
2013-10-25,yoho,(used as a call or shout to attract attention, accompany effort, etc.),to shout “yo-ho!”,
2013-10-24,bequeath,to dispose of (personal property, especially money) by last will: She bequeathed her half of the company to her niece.,to hand down; pass on.,Obsolete. to commit; entrust.,
2013-10-23,falderal,mere nonsense; foolish talk or ideas.,a trifle; gimcrack; gew-gaw.,
2013-10-22,chattel,Law. a movable article of personal property.,any article of tangible property other than land, buildings, and other things annexed to land.,a slave.,
2013-10-21,analysand,Psychiatry. a person undergoing psychoanalysis.,
2013-10-20,ennoble,to elevate in degree, excellence, or respect; dignify; exalt: a personality ennobled by true generosity.,to confer a title of nobility on.,
2013-10-19,shoal,a place where a sea, river, or other body of water is shallow.,a sandbank or sand bar in the bed of a body of water, especially one that is exposed above the surface of the water at low tide.,of little depth, as water; shallow.,
2013-10-18,aureole,a radiance surrounding the head or the whole figure in the representation of a sacred personage.,any encircling ring of light or color; halo.,Astronomy. corona.,
2013-10-17,blowzy,having a coarse, ruddy complexion.,disheveled in appearance; unkempt.,
2013-10-16,pinion,Machinery. A. a gear with a small number of teeth, especially one engaging with a rack or larger gear. B. a shaft or spindle cut with teeth engaging with a gear.,Metalworking. a gear driving a roll in a rolling mill.,
2013-10-15,arraign,to call or bring before a court to answer to an indictment.,to accuse or charge in general; criticize adversely; censure.,
2013-10-14,solipsism,Philosophy. the theory that only the self exists, or can be proved to exist.,extreme preoccupation with and indulgence of one's feelings, desires, etc.; egoistic self-absorption.,
2013-10-13,trepan,a person who ensnares or entraps others.,a stratagem; a trap.,to ensnare or entrap.,
2013-10-12,promulgate,to make known by open declaration; publish; proclaim formally or put into operation (a law, decree of a court, etc.).,to set forth or teach publicly (a creed, doctrine, etc.).,
2013-10-11,snollygoster,Slang. a clever, unscrupulous person.,
2013-10-10,annulate,having rings or ringlike bands.,formed of ringlike segments, as an annelid worm.,
2013-10-09,obverse,the side of a coin, medal, flag, etc., that bears the principal design (opposed to reverse).,the front or principal surface of anything.,a counterpart.,
2013-10-08,tittup,an exaggerated prancing, bouncing movement or manner of moving.,to move, especially to walk, in an exaggerated prancing or bouncing way, as a spirited horse.,
2013-10-07,picaro,a rogue or vagabond.,
2013-10-06,malign,to speak harmful untruths about; speak evil of; slander; defame: to malign an honorable man.,evil in effect; pernicious; baleful; injurious: The gloomy house had a malign influence upon her usually good mood.,having or showing an evil disposition; malevolent; malicious.,
2013-10-05,whirligig,something that whirls or revolves.,a whirling motion or course: the whirligig of fashion.,a giddy or flighty person.,
2013-10-04,bluestocking,a woman with considerable scholarly, literary, or intellectual ability or interest.,a member of a mid-18th-century London literary circle: Lady Montagu was a celebrated bluestocking.,
2013-10-03,hoosgow,Slang. a jail.,
2013-10-02,emanate,to flow out, issue, or proceed, as from a source or origin; come forth; originate. Synonyms: arise, spring, flow.,to send forth; emit.,
2013-10-01,loblolly,South Midland and Southern U.S. a mire; mudhole.,a thick gruel.,
2013-09-30,instauration,renewal; restoration; renovation; repair.,Obsolete. an act of instituting something; establishment.,
2013-09-29,contrail,a visible condensation of water droplets or ice crystals from the atmosphere, occurring in the wake of an aircraft, rocket, or missile under certain conditions.,
2013-09-28,gangle,to move awkwardly or ungracefully: A tall, stiff-jointed man gangled past.,
2013-09-27,indubitable,that cannot be doubted; patently evident or certain; unquestionable.,
2013-09-26,sectile,capable of being cut smoothly with a knife.,
2013-09-25,albedo,the white, inner rind of a citrus fruit.,Astronomy. the ratio of the light reflected by a planet or satellite to that received by it.,Meteorology. such a ratio for any part of the earth's surface or atmosphere.,
2013-09-24,fermata,the sustaining of a note, chord, or rest for a duration longer than the indicated time value, with the length of the extension at the performer's discretion.,a symbol placed over a note, chord, or rest indicating a fermata.,
2013-09-23,pilose,covered with hair, especially soft hair; furry.,
2013-09-22,sobersided,solemn or grave in disposition, attitude, character, etc.; serious-minded.,
2013-09-21,lallygag,to spend time idly; loaf.,to indulge in kisses and caresses; make love; neck.,
2013-09-20,Parnassian,pertaining to poetry.,pertaining to Mount Parnassus.,of, pertaining to, or noting a school of French poets of the latter half of the 19th century, characterized chiefly by a belief in art for art's sake, by an emphasis on metrical form, and by the repression of emotive elements: so called from Le Parnasse Contemporain, the title of their first collection of poems, published in 1866.,
2013-09-19,humdinger,a person, thing, action, or statement of remarkable excellence or effect.,
2013-09-18,monad,a single unit or entity.,Biology. a. any simple, single-celled organism. b. any of various small, flagellate, colorless ameboids with one to three flagella, especially of the genus Monas.,Chemistry. an element, atom, or group having a valence of one. Compare dyad (def. 3), triad (def. 2a).,
2013-09-17,fleer,to grin or laugh coarsely or mockingly.,to mock or deride.,a fleering look; a jeer or gibe.,
2013-09-16,orrery,an apparatus for representing the positions, motions, and phases of the planets, satellites, etc., in the solar system.,any of certain similar machines, as a planetarium.,
2013-09-15,joggle,to shake slightly; move to and fro, as by repeated jerks; jiggle: She joggled the key in the lock a couple of times before getting the door open.,to cause to shake or totter as by a sudden, slight push; jostle.,to join or fasten by fitting a projection into a recess.,
2013-09-14,dissilient,bursting apart; bursting open.,
2013-09-13,anfractuous,characterized by windings and turnings; sinuous; circuitous: an anfractuous path.,
2013-09-12,bordereau,a detailed memorandum, especially one in which documents are listed.,
2013-09-11,ikat,a method of printing woven fabric by tie-dyeing the warp yarns (warp ikat), the weft yarns (weft ikat), or both (double ikat) before weaving.,a fabric made by this method.,
2013-09-10,bauble,a showy, usually cheap, ornament; trinket; gewgaw.,a jester's scepter.,
2013-09-09,peplum,a short full flounce or an extension of a garment below the waist, covering the hips.,a short skirt attached to a bodice or jacket.,Obsolete. a peplos.,
2013-09-08,chambray,a fine cloth of cotton, silk, or linen, commonly of plain weave with a colored warp and white weft.,
2013-09-07,toile,any of various transparent linens and cottons.,toile de Jouy.,
2013-09-06,gingham,yarn-dyed, plain-weave cotton fabric, usually striped or checked.,
2013-09-05,habiliment,Usually,<b> habiliments</b>. a. clothes or clothing. b. clothes as worn in a particular profession, way of life, etc.,<b>habiliments</b>, accouterments or trappings.,
2013-09-04,skedaddle,to run away hurriedly; flee.,a hasty flight.,
2013-09-03,serotinal,pertaining to or occurring in late summer.,
2013-09-02,pari passu,with equal pace or progress; side by side.,without partiality; equably; fairly.,
2013-09-01,auspicate,to initiate with ceremonies calculated to ensure good luck; inaugurate.,
2013-08-31,corsair,a pirate, especially formerly of the Barbary Coast.,a fast ship used for piracy.,(initial capital letter) Military. a gull-winged, propeller-driven fighter plane built for the U.S. Navy in World War II and kept in service into the early 1950s.,
2013-08-30,gynarchy,government by women.,
2013-08-29,bulbous,bulb-shaped; bulging.,having or growing from bulbs.,
2013-08-28,pittance,a small amount or share.,a small allowance or sum, as of money for living expenses.,a scanty income or remuneration.,
2013-08-27,meander,to proceed by or take a winding or indirect course: The stream meandered through the valley.,to wander aimlessly; ramble: The talk meandered on.,Surveying. to define the margin of (a body of water) with a meander line.,
2013-08-26,troubadour,one of a class of medieval lyric poets who flourished principally in southern France from the 11th to 13th centuries, and wrote songs and poems of a complex metrical form in langue d'oc, chiefly on themes of courtly love. Compare trouvère.,any wandering singer or minstrel.,
2013-08-25,doggerel,(of verse) a. comic or burlesque, and usually loose or irregular in measure. b. rude; crude; poor.,doggerel verse.,
2013-08-24,bedraggle,to make limp and soiled, as with rain or dirt.,
2013-08-23,viceroy,a person appointed to rule a country or province as the deputy of the sovereign: the viceroy of India.,a brightly marked American butterfly, Limenitis archippus, closely mimicking the monarch butterfly in coloration.,
2013-08-22,quincunx,an arrangement of five objects, as trees, in a square or rectangle, one at each corner and one in the middle.,Botany. an overlapping arrangement of five petals or leaves, in which two are interior, two are exterior, and one is partly interior and partly exterior.,
2013-08-21,gibbous,Astronomy. (of a heavenly body) convex at both edges, as the moon when more than half full.,humpbacked,
2013-08-20,psaltery,an ancient musical instrument consisting of a flat sounding box with numerous strings which are plucked with the fingers or with a plectrum.,(initial capital letter) the Psalter.,
2013-08-19,od,a hypothetical force formerly held to pervade all nature and to manifest itself in magnetism, mesmerism, chemical action, etc.,
2013-08-18,lacerate,to tear roughly; mangle: The barbed wire lacerated his hands.,to distress or torture mentally or emotionally; wound deeply; pain greatly: His bitter criticism lacerated my heart.,lacerated.,
2013-08-17,espousal,adoption or advocacy, as of a cause or principle.,Sometimes, espousals. a. a marriage ceremony. b. an engagement or betrothal celebration.,
2013-08-16,cummerbund,a wide sash worn at the waist, especially a horizontally pleated one worn with a tuxedo.,
2013-08-15,impolitic,not politic, expedient, or judicious.,
2013-08-14,dither,to act irresolutely; vacillate.,North England. to tremble with excitement or fear.,a trembling; vibration.,
2013-08-13,jilt,to reject or cast aside (a lover or sweetheart), especially abruptly or unfeelingly.,a woman who jilts a lover.,
2013-08-12,matador,the principal bullfighter in a bullfight who passes the bull with a muleta and then, in many countries, kills it with a sword thrust; a torero.,one of the principal cards in skat and certain other games.,(initial capital letter) a jet-powered U.S. surface-to-surface missile.,
2013-08-11,kloof,(in South Africa) a deep glen; ravine.,
2013-08-10,helter-skelter,in headlong and disorderly haste: The children ran helter-skelter all over the house.,in a haphazard manner; without regard for order: Clothes were scattered helter-skelter about the room.,carelessly hurried; confused: They ran in a mad, helter-skelter fashion for the exits.,
2013-08-09,finagle,to trick, swindle, or cheat (a person) (often followed by out of): He finagled the backers out of a fortune.,to get or achieve (something) by guile, trickery, or manipulation: to finagle an assignment to the Membership Committee.,to practice deception or fraud; scheme.,
2013-08-08,waif,a person, especially a child, who has no home or friends.,something found, especially a stray animal, whose owner is not known.,a stray item or article: to gather waifs of gossip.,
2013-08-07,holograph,wholly written by the person in whose name it appears: a holograph letter.,a holograph writing, as a deed, will, or letter.,
2013-08-06,eyetooth,Dentistry. a canine tooth of the upper jaw: so named from its position under the eye.,<strong>cut one's eyeteeth</strong>, a. to gain sophistication or experience; become worldly-wise. b. Also, <strong>cut one's eyeteeth on.</strong> to be initiated or gain one's first experience in (a career, hobby, skill, etc.).,<strong>give one's eyeteeth</strong>, to give something one considers very precious, usually in exchange for an object or situation one desires: She would give her eyeteeth for that job.,
2013-08-05,hyperhidrosis,abnormally excessive sweating.,
2013-08-04,rarefied,extremely high or elevated; lofty; exalted: the rarefied atmosphere of a scholarly symposium.,of, belonging to, or appealing to an exclusive group; select; esoteric: rarefied tastes.,
2013-08-03,spigot,a small peg or plug for stopping the vent of a cask.,a peg or plug for stopping the passage of liquid in a faucet or cock.,a faucet or cock for controlling the flow of liquid from a pipe or the like.,
2013-08-02,lam,to beat; thrash.,to beat; strike; thrash (usually followed by out or into).,
2013-08-01,bemused,bewildered or confused.,lost in thought; preoccupied.,
2013-07-31,residuum,the residue, remainder, or rest of something.,Also, residue. Chemistry. a quantity or body of matter remaining after evaporation, combustion, distillation, etc.,any residual product.,
2013-07-30,esse,being; existence.,
2013-07-29,coaptation,a joining or adjustment of parts to one another: the coaptation of a broken bone.,
2013-07-28,dreck,worthless trash; junk.,excrement; dung.,
2013-07-27,additament,something added; an addition.,
2013-07-26,cyclopean,(sometimes lowercase) gigantic; vast.,of or characteristic of the Cyclops.,(usually lowercase) Architecture, Building Trades. formed with or containing large, undressed stones fitted closely together without the use of mortar: a cyclopean wall.,
2013-07-25,dispositive,involving or affecting disposition or settlement: a dispositive clue in a case of embezzlement.,
2013-07-24,grammatology,the scientific study of systems of writing.,
2013-07-23,sidle,to move sideways or obliquely.,to edge along furtively.,a sidling movement.,
2013-07-22,quillet,a subtlety or quibble.,
2013-07-21,clangor,a loud, resonant sound; clang.,clamorous noise.,to make a clangor; clang.,
2013-07-20,bushwa,rubbishy nonsense; baloney; bull: You'll hear a lot of boring bushwa about his mechanical skill.,
2013-07-19,rendezvous,to assemble at an agreed time and place.,an agreement between two or more persons to meet at a certain time and place.,the meeting itself.,
2013-07-18,poetaster,an inferior poet; a writer of indifferent verse.,
2013-07-17,gobbet,a lump or mass.,a fragment or piece, especially of raw flesh.,
2013-07-16,scabrous,full of difficulties.,having a rough surface because of minute points or projections.,indecent or scandalous; risqué; obscene: scabrous books.,
2013-07-15,fribble,to act in a foolish or frivolous manner; trifle.,to waste foolishly (often followed by away): He fribbled away one opportunity after another.,a foolish or frivolous person; trifler.,
2013-07-14,rifacimento,a recast or adaptation, as of a literary or musical work.,
2013-07-13,Sisyphean,endless and unavailing, as labor or a task.,of or pertaining to Sisyphus.,
2013-07-12,ploce,the repetition of a word or phrase to gain special emphasis or to indicate an extension of meaning, as in Ex. 3:14: “I am that I am.”,
2013-07-11,accrete,to grow together; adhere (usually followed by to).,to add, as by growth.,Botany. grown together.,
2013-07-10,boniface,any landlord or innkeeper.,Saint (Wynfrith), a.d. 680?–755?, English monk who became a missionary in Germany.,a jovial innkeeper in George Farquhar's The Beaux' Stratagem.,
2013-07-09,layette,an outfit of clothing, bedding, etc., for a newborn baby.,
2013-07-08,edacity,the state of being edacious; voraciousness; appetite.,
2013-07-07,yawp,to utter a loud, harsh cry; to yelp, squawk, or bawl.,Slang. to talk noisily and foolishly or complainingly.,a harsh cry.,
2013-07-06,integrant,making up or being a part of a whole; constituent.,an integrant part.,a solid, rigid sheet of building material composed of several layers of the same or of different materials.,
2013-07-05,blighter,a chap; bloke.,a contemptible, worthless person, especially a man; scoundrel or rascal.,
2013-07-04,dandy,Informal. something or someone of exceptional or first-rate quality: Your reply was a dandy.,a man who is excessively concerned about his clothes and appearance; a fop.,characteristic of a dandy; foppish.,
2013-07-03,lyceum,an institution for popular education providing discussions, lectures, concerts, etc.,a building for such activities.,(initial capital letter) the gymnasium where Aristotle taught, in ancient Athens.,
2013-07-02,sprechgesang,a vocal style intermediate between speech and singing but without exact pitch intonation.,
