2004-06-09,braggadocio,A braggart.,Empty boasting.,A swaggering, cocky manner.,
2004-06-08,enjoin,To direct or impose with authority; to order.,To prohibit; to forbid.,
2004-06-07,mendicant,A beggar; especially, one who makes a business of begging.,A member of an order of friars forbidden to acquire landed property and required to be supported by alms.,Practicing beggary; begging; living on alms; as, mendicant friars.,
2004-06-06,dictum,An authoritative statement; a formal pronouncement.,Law) A judicial opinion expressed by judges on points that do not necessarily arise in the case, and are not involved in it.,
2004-06-05,comely,Pleasing or agreeable to the sight; good-looking.,Suitable or becoming; proper; agreeable.,
2004-06-04,vade mecum,A book for ready reference; a manual; a handbook.,A useful thing that one regularly carries about.,
2004-06-03,palliate,to relieve or lessen without curing; mitigate; alleviate.,to try to mitigate or conceal the gravity of (an offense) by excuses, apologies, etc.; extenuate.,
2004-06-02,autochthonous,Aboriginal; indigenous; native.,Formed or originating in the place where found.,
2004-06-01,starveling,One who is thin from lack of food, or who is starving or being starved.,Being a starveling.,Poor in quality; inadequate.,
2004-05-31,politic,Of or pertaining to polity, or civil government; political (as in the phrase "the body politic").,(Of persons): Sagacious in promoting a policy; ingenious in devising and advancing a system of management; characterized by political skill and ingenuity; hence, shrewdly tactful, cunning.,(Of actions or things): Pertaining to or promoting a policy; hence, judicious; expedient; as, "a politic decision.",
2004-05-30,aegis,Protection; support.,Sponsorship; patronage.,Guidance, direction, or control.,
2004-05-29,pernicious,Highly injurious; deadly; destructive; exceedingly harmful.,
2004-05-28,olla podrida,A stew of highly seasoned meat and vegetables.,A mixture; a hodgepodge.,
2004-05-27,fetor,A strong, offensive smell; stench.,
2004-05-26,cap-a-pie,From head to foot; at all points.,
2004-05-25,agrestic,Pertaining to fields or the country; rural; rustic.,
2004-05-24,irrupt,To burst in forcibly or suddenly; to intrude.,(Ecology) To increase rapidly in number.,
2004-05-23,tarradiddle,A petty falsehood; a fib.,Pretentious nonsense.,
2004-05-22,glabrous,Smooth; having a surface without hairs, projections, or any unevenness.,
2004-05-21,crabwise,Sideways.,In a cautiously indirect manner.,
2004-05-20,abecedarian,a person who is learning the letters of the alphabet.,a beginner in any field of learning.,of or pertaining to the alphabet.,
2004-05-19,doyen,The senior member of a body or group.,One who is knowledgeable or uniquely skilled as a result of long experience in some field of endeavor.,A woman who is a doyen.,
2004-05-18,accede,To agree or assent; to give in to a request or demand.,To become a party to an agreement, treaty, convention, etc.,To attain an office or rank; to enter upon the duties of an office.,
2004-05-17,redoubtable,Arousing fear or alarm; formidable.,Illustrious; eminent; worthy of respect or honor.,
2004-05-16,neologism,A new word or expression.,A new use of a word or expression.,The use or creation of new words or expressions.,
2004-05-15,hullabaloo,A confused noise; uproar; tumult.,
2004-05-14,roue,A man devoted to a life of sensual pleasure; a debauchee; a rake.,
2004-05-13,suasion,The act of persuading; persuasion.,
2004-05-12,bromide,a platitude or trite saying.,Chemistry. a. a salt of hydrobromic acid consisting of two elements, one of which is bromine, as sodium bromide, NaBr. b. a compound containing bromine, as methyl bromide.,Pharmacology. potassium bromide, known to produce central nervous system depression, formerly used as a sedative.,
2004-05-11,conflagration,A large and destructive fire; a general burning.,Something like a conflagration; conflict; war.,
2004-05-10,sentient,Capable of perceiving by the senses; conscious.,Experiencing sensation or feeling.,
2004-05-09,apologia,A formal defense or justification, especially of one's opinions, position, or actions.,
2004-05-08,ignoramus,An ignorant person; a dunce.,
2004-05-07,hardscrabble,Yielding a bare or meager living with great labor or difficulty.,Marked by poverty.,
2004-05-06,preternatural,Existing outside of nature; differing from the natural; nonnatural.,Surpassing the usual or normal; extraordinary; abnormal.,Beyond or outside ordinary experience; inexplicable by ordinary means.,
2004-05-05,embonpoint,excessive plumpness; stoutness.,
2004-05-04,militate,To have force or influence.,
2004-05-03,abstruse,Difficult to comprehend or understand.,
2004-05-02,urbane,having the polish and suavity regarded as characteristic of sophisticated social life in major cities: an urbane manner.,reflecting elegance, sophistication, etc., especially in expression: He maintained an urbane tone in his letters.,
2004-05-01,commensurate,Equal in measure, extent, or duration.,Corresponding in size or degree or extent; proportionate.,Having a common measure; commensurable; reducible to a common measure; as, commensurate quantities.,
2004-04-30,verisimilitude,the appearance or semblance of truth; likelihood; probability: The play lacked verisimilitude.,something, as an assertion, having merely the appearance of truth.,
2004-04-29,predilection,A predisposition to choose or like; an established preference.,
2004-04-28,heterodox,Contrary to or differing from some acknowledged standard, especially in church doctrine or dogma; unorthodox.,Holding unorthodox opinions or doctrines.,
2004-04-27,supine,Lying on the back, or with the face upward.,Indolent; listless; inactive; mentally or morally lethargic.,
2004-04-26,lucubration,The act of studying by candlelight; nocturnal study; meditation.,That which is composed by night; that which is produced by meditation in retirement; hence (loosely) any literary composition.,
2004-04-25,gravid,Being with child; heavy with young or eggs; pregnant.,
2004-04-24,nascent,Beginning to exist or having recently come into existence; coming into being.,
2004-04-23,scapegrace,A reckless, unprincipled person; one who is wild and reckless; a rascal; a scoundrel.,
2004-04-22,commodious,spacious and convenient; roomy: a commodious apartment.,ample or adequate for a particular purpose: a commodious harbor.,
2004-04-21,small beer,Weak beer.,Insignificant matters; something of little importance.,Unimportant; trivial.,
2004-04-20,harbinger,(Archaic) One who provides lodgings; especially, the officer of the English royal household who formerly preceded the court when traveling, to provide and prepare lodgings.,A forerunner; a precursor; one that presages or foreshadows what is to come.,To signal the approach of; to presage; to be a harbinger of.,
2004-04-19,peremptory,Precluding or putting an end to all debate or action.,Not allowing contradiction or refusal; absolute; decisive; conclusive; final.,Expressive of urgency or command.,
2004-04-18,wan,Having a pale or sickly hue; pale; pallid.,Lacking vitality, as from weariness, illness, or unhappiness; feeble.,Lacking in intensity or brightness; dim or feeble.,
2004-04-17,troglodyte,A member of a primitive people that lived in caves, dens, or holes; a cave dweller.,One who is regarded as reclusive, reactionary, out of date, or brutish.,
2004-04-16,ossify,to become rigid or inflexible in habits, attitudes, opinions, etc.: a young man who began to ossify right after college.,to convert into or cause to harden like bone.,to become bone or harden like bone.,
2004-04-15,privation,An act or instance of depriving.,The state of being deprived of something, especially of something required or desired; destitution; need.,
2004-04-14,myrmidon,(Capitalized) A member of a warlike Thessalian people who followed Achilles on the expedition against Troy.,A loyal follower, especially one who executes orders without question.,
2004-04-13,carom,A rebound following a collision; a glancing off.,A shot in billiards in which the cue ball successively strikes two other balls on the table.,To strike and rebound; to glance.,
2004-04-12,improvident,Lacking foresight or forethought; not foreseeing or providing for the future; negligent or thoughtless.,
2004-04-11,apprise,To give notice to; to inform; -- often followed by of; as, we will apprise the general of an intended attack; he apprised the commander of what he had done.,
2004-04-10,renege,To go back on a promise or commitment.,
2004-04-09,impregnable,Not capable of being stormed or taken by assault; unconquerable; as, an impregnable fortress.,Difficult or impossible to overcome or refute successfully; beyond question or criticism; as, an impregnable argument.,
2004-04-08,bailiwick,A person's specific area of knowledge, authority, interest, skill, or work.,The office or district of a bailiff.,
2004-04-07,remonstrate,To present and urge reasons in opposition to an act, measure, or any course of proceedings -- usually used with 'with'.,To say or plead in protest, opposition, or reproof.,
2004-04-06,vertiginous,Affected with vertigo; giddy; dizzy.,Causing or tending to cause dizziness.,Turning round; whirling; revolving.,
2004-04-05,palaver,Idle talk,Talk intended to beguile or deceive.,A parley usually between persons of different backgrounds or cultures or levels of sophistication; a talk; hence, a public conference and deliberation.,
2004-04-04,tirade,A long angry speech; a violent denunciation; a prolonged outburst full of censure or abuse.,
2004-04-03,mountebank,A peddler of quack medicine, who stands on a platform to appeal to the audience.,A charlatan; a boastful pretender to knowledge or a skill.,
2004-04-02,coterminous,Having the same or coincident boundaries.,Having the same scope, range of meaning, duration.,
2004-04-01,puckish,mischievous; impish.,
2004-03-31,approbation,The act of approving; formal or official approval.,Praise; commendation.,
2004-03-30,grandiloquent,Lofty in style; pompous; bombastic.,
2004-03-29,proscribe,To denounce, condemn, or forbid as harmful; to prohibit.,To put outside the protection of the law; to outlaw.,To publish the name of (a person) as condemned to death with his property forfeited to the state.,
2004-03-28,ken,knowledge, understanding, or cognizance; mental perception: an idea beyond one's ken.,range of sight or vision.,Chiefly Scot. a. to know, have knowledge of or about, or be acquainted with (a person or thing). b. to understand or perceive (an idea or situation).,
2004-03-27,inimical,Having the disposition or temper of an enemy; unfriendly; unfavorable.,Opposed in tendency, influence, or effects; antagonistic; adverse.,
2004-03-26,mephitic,Offensive to the smell; as, mephitic odors.,Poisonous; noxious.,
2004-03-25,gambol,To dance and skip about in play; to frolic.,to skip about, as in dancing or playing; frolic.,A skipping or leaping about in frolic.,
2004-03-24,perorate,To conclude or sum up a long discourse.,To speak or expound at length; to declaim.,
2004-03-23,woebegone,Beset or overwhelmed with woe; immersed in grief or sorrow; woeful.,Being in a sorry condition; dismal-looking; dilapidated; run-down.,
2004-03-22,repletion,The condition of being completely filled or supplied.,Excessive fullness, as from overeating.,
2004-03-21,connubial,Of or pertaining to marriage, or the marriage state; conjugal; nuptial.,
2004-03-20,salad days,A time of youthful inexperience, innocence, or indiscretion.,
2004-03-19,anathema,A ban or curse pronounced with religious solemnity by ecclesiastical authority, and accompanied by excommunication. Hence: Denunciation of anything as accursed.,An imprecation; a curse; a malediction.,Any person or thing anathematized, or cursed by ecclesiastical authority.,
2004-03-18,doughty,steadfastly courageous and resolute; valiant.,
2004-03-17,perfidy,The act of violating faith or allegiance; violation of a promise or vow; faithlessness; treachery.,
2004-03-16,redound,To have a consequence or effect.,To return; to rebound; to reflect.,To become added or transferred; to accrue.,
2004-03-15,malinger,to pretend illness, especially in order to shirk one's duty, avoid work, etc.,
2004-03-14,sanctum,A sacred place.,A place of retreat where one is free from intrusion.,
2004-03-13,deign,To think worthy; to condescend -- followed by an infinitive.,To condescend to give or bestow; to stoop to furnish; to grant.,
2004-03-12,efficacious,Capable of having the desired result or effect; effective as a means, measure, remedy, etc.,
2004-03-11,apocryphal,of doubtful authorship or authenticity.,Ecclesiastical. a. (initial capital letter) of or pertaining to the Apocrypha. b. of doubtful sanction; uncanonical.,false; spurious: He told an apocryphal story about the sword, but the truth was later revealed.,
2004-03-10,patrician,A member of one of the original citizen families of ancient Rome.,A person of high birth; a nobleman.,A person of refined upbringing, manners, and taste.,
2004-03-09,truckle,To yield or bend obsequiously to the will of another; to act in a subservient manner.,A small wheel or roller; a caster.,
2004-03-08,idyll,A simple descriptive work, either in poetry or prose, dealing with simple, rustic life; pastoral scenes; and the like.,A narrative poem treating an epic, romantic, or tragic theme.,A lighthearted carefree episode or experience.,
2004-03-07,vagary,An extravagant, erratic, or unpredictable notion, action, or occurrence.,
2004-03-06,pettifogger,A petty, unscrupulous lawyer; a shyster.,A person who quibbles over trivia.,
2004-03-05,fait accompli,An accomplished and presumably irreversible deed or fact.,
2004-03-04,bowdlerize,To remove or modify the parts (of a book, for example) considered offensive.,To modify, as by shortening, simplifying, or distorting in style or content.,
2004-03-03,invective,An abusive expression or speech; a vehement verbal attack.,Insulting or abusive language.,Of, relating to, or characterized by insult, abuse, or denunciatory language.,
2004-03-02,qua,In the capacity or character of; as.,
2004-03-01,tenet,Any opinion, principle, dogma, belief, or doctrine that a person holds or maintains as true.,
2004-02-29,pleonasm,The use of more words than are necessary to express an idea; as, "I saw it with my own eyes.",An instance or example of pleonasm.,A superfluous word or expression.,
2004-02-28,vet,To provide veterinary care for (an animal).,To provide (a person) with medical care.,To examine carefully; to subject to thorough appraisal; to evaluate.,
2004-02-27,raffish,Characterized by or suggestive of flashy vulgarity, crudeness, or rowdiness; tawdry.,Marked by a carefree unconventionality or disreputableness; rakish.,
2004-02-26,malapropism,An act or habit of misusing words ridiculously, esp. by the confusion of words that are similar in sound.,An example of such misuse.,
2004-02-25,flibbertigibbet,Archaic. a gossip.,a chattering or flighty, light-headed person.,
2004-02-24,recrudescent,Breaking out again after temporary abatement or suppression; as, a recrudescent epidemic.,
2004-02-23,lambaste,To give a thrashing to; to beat severely.,To scold sharply; to attack verbally; to berate.,
2004-02-22,gauche,lacking social grace, sensitivity, or acuteness; awkward; crude; tactless: Their exquisite manners always make me feel gauche.,
2004-02-21,expiate,To make amends for; to atone for.,
2004-02-20,avatar,The incarnation of a deity -- chiefly associated in Hinduism with the incarnations of Vishnu.,An embodiment, as of a quality, concept, philosophy, or tradition; an archetype.,A temporary manifestation or aspect of a continuing entity.,
2004-02-19,inscrutable,Difficult to fathom or understand; difficult to be explained or accounted for satisfactorily; obscure; incomprehensible; impenetrable.,
2004-02-18,quietus,Final discharge or acquittance, as from debt or obligation.,Removal from activity; rest; death.,Something that serves to suppress or quiet.,
2004-02-17,tractable,Capable of being easily led, taught, or managed; docile.,Easily handled, managed, or worked; malleable.,
2004-02-16,plaintive,Expressive of sorrow or melancholy; mournful; sad.,
2004-02-15,discrete,Constituting a separate thing; distinct.,Consisting of distinct or unconnected parts.,(Mathematics) Defined for a finite or countable set of values; not continuous.,
2004-02-14,buss,A kiss; a playful kiss; a smack.,To kiss; especially to kiss with a smack.,
2004-02-13,hinterland,A region situated inland from a coast.,A region remote from urban areas; backcountry.,A region situated beyond the major metropolitan or cultural centers.,
2004-02-12,latitudinarian,Having or expressing broad and tolerant views, especially in religious matters.,A person who is broad-minded and tolerant; one who displays freedom in thinking, especially in religious matters.,[Often capitalized] A member of the Church of England, in the time of Charles II, who adopted more liberal notions in respect to the authority, government, and doctrines of the church than generally prevailed.,
2004-02-11,insuperable,Incapable of being passed over, surmounted, or overcome; insurmountable; as, "insuperable difficulties.",
2004-02-10,bombinate,To buzz; to hum; to drone.,to make a humming or buzzing noise.,
2004-02-09,forcible,Using force against opposition or resistance; effected or accomplished by force; as, "forcible entry or abduction.",Characterized by force, efficiency, or energy; powerful.,
2004-02-08,rapport,A relation, especially one characterized by sympathetic understanding, emotional affinity, or mutual trust.,
2004-02-07,miasma,A vaporous exhalation (as of marshes or putrid matter) formerly thought to cause disease; broadly, a thick vaporous atmosphere or emanation.,A harmful or corrupting atmosphere or influence; also, an atmosphere that obscures; a fog.,
2004-02-06,hector,A bully.,To intimidate or harass in a blustering way; to bully.,To play the bully; to bluster.,
2004-02-05,censure,The act of blaming or finding fault with and condemning as wrong; reprehension; blame.,An official reprimand or expression of disapproval.,To find fault with and condemn as wrong; to blame; to criticize severely.,
2004-02-04,pulchritude,That quality of appearance which pleases the eye; beauty; comeliness; grace; loveliness.,
2004-02-03,languor,Mental or physical weariness or fatigue.,Listless indolence, especially the indolence of one who is satiated by a life of luxury or pleasure.,A heaviness or oppressive stillness of the air.,
2004-02-02,quixotic,extravagantly chivalrous or romantic; visionary, impractical, or impracticable.,(sometimes initial capital letter) resembling or befitting Don Quixote.,impulsive and often rashly unpredictable.,
2004-02-01,surreptitious,Done, made, or gotten by stealth.,Acting with or marked by stealth.,
2004-01-31,quandary,A state of difficulty, perplexity, doubt, or uncertainty.,
2004-01-30,opprobrium,Disgrace; infamy; reproach mingled with contempt.,A cause or object of reproach or disgrace.,
2004-01-29,soi-disant,Self-styled; so-called.,
2004-01-28,hebetude,the state of being dull; lethargy.,
2004-01-27,frangible,easily broken; breakable: Most frangible toys are not suitable for young children.,
2004-01-26,peripatetic,walking or traveling about; itinerant.,(initial capital letter) of or relating to Aristotle, who taught philosophy while walking in the Lyceum of ancient Athens.,(initial capital letter) of or relating to the Aristotelian school of philosophy.,
2004-01-25,concinnity,Internal harmony or fitness in the adaptation of parts to a whole or to each other.,Studied elegance of design or arrangement -- used chiefly of literary style.,An instance of concinnity.,
2004-01-24,abeyance,Suspension; temporary cessation.,
2004-01-23,unguent,A salve for sores, burns, or the like; an ointment.,
2004-01-22,slaver,To slobber; to drool.,Saliva drooling from the mouth.,
2004-01-21,pantheon,A temple dedicated to all the gods; especially (capitalized), the building so called at Rome.,The collective gods of a people; as, a goddess of the Greek pantheon.,A public building commemorating and dedicated to the famous dead of a nation.,
2004-01-20,galvanic,Of, pertaining to, or producing a direct current of electricity, especially when produced chemically.,Affecting or affected as if by an electric shock; startling; shocking.,Stimulating; energizing.,
2004-01-19,bilious,Of or pertaining to bile.,Marked by an excess secretion of bile.,Pertaining to, characterized by, or affected by gastric distress caused by a disorder of the liver.,
2004-01-18,irenic,tending to promote peace or reconciliation; peaceful or conciliatory.,
2004-01-17,timorous,Full of apprehensiveness; timid; fearful.,Indicating, or caused by, fear.,
2004-01-16,yen,A desire or craving.,An aluminum coin and monetary unit of Japan, equal to 100 sen or 1000 rin.,To have a craving; yearn.,
2004-01-15,serendipity,The faculty or phenomenon of making fortunate accidental discoveries.,
2004-01-14,obstreperous,resisting control or restraint in a difficult manner; unruly.,noisy, clamorous, or boisterous: obstreperous children.,
2004-01-13,tergiversation,The act of practicing evasion or of being deliberately ambiguous.,The act of abandoning a party or cause.,
2004-01-12,gustatory,Of or pertaining to the sense of taste.,
2004-01-11,venerate,To treat someone or something with deep respect, reverence or deference; to revere.,
2004-01-10,effete,No longer capable of producing young; infertile; barren; sterile.,Exhausted of energy; incapable of efficient action; worn out.,Marked by self-indulgence or decadence; degenerate.,
2004-01-09,asperity,Roughness of surface; unevenness.,Roughness or harshness of sound; a quality that grates upon the ear.,Roughness of manner; severity; harshness.,
2004-01-08,clamber,To climb with difficulty, or on all fours; to scramble.,The act of clambering.,
2004-01-07,variegated,Having marks or patches of different colors; as, "variegated leaves or flowers.",Varied; distinguished or characterized by variety; diversified.,
2004-01-06,penury,Extreme poverty; destitution.,Absence of resources; insufficiency.,
2004-01-05,abrogate,To annul or abolish by an authoritative act.,To put an end to; to do away with.,
2004-01-04,sycophant,A person who attempts to win favor by flattering people of wealth or influence; a parasite; a toady.,
2004-01-03,vivify,To endue with life; to make alive; to animate.,To make more lively or intense.,
2004-01-02,surly,Ill-humored; churlish in manner or mood; sullen and gruff.,Menacing or threatening in appearance, as of weather conditions; ominous.,
2004-01-01,neoteric,Recent in origin; modern; new.,
