2004-12-31,tintinnabulation,A tinkling sound, as of a bell or bells.,
2004-12-30,riposte,a quick, sharp return in speech or action; counterstroke: a brilliant riposte to an insult.,Fencing. a quick thrust given after parrying a lunge.,to make a riposte.,
2004-12-29,sedition,Conduct or language inciting resistance to or rebellion against lawful authority.,
2004-12-28,raillery,Good-humored banter or teasing.,An instance of good-humored teasing; a jest.,
2004-12-27,brackish,Somewhat salty.,Distasteful; unpalatable.,
2004-12-26,punctilious,Strictly attentive to the details of form in action or conduct; precise; exact in the smallest particulars.,
2004-12-25,benison,Blessing; benediction.,
2004-12-24,cornucopia,The horn of plenty, from which fruits and flowers are represented as issuing. It is an emblem of abundance.,An overflowing supply; an abundance.,
2004-12-23,exegesis,Exposition; explanation; especially, a critical explanation of a text.,
2004-12-22,moil,To work with painful effort; to labor; to toil; to drudge.,To churn or swirl about continuously.,Toil; hard work; drudgery.,
2004-12-21,etiolate,(Botany) To bleach and alter the natural development of (a green plant) by excluding sunlight.,To make pale or sickly.,To make weak by stunting the growth or development of.,
2004-12-20,languid,Drooping or flagging from or as if from exhaustion; weak; weary; heavy.,Promoting or indicating weakness or heaviness.,Slow; lacking vigor or force.,
2004-12-19,disconsolate,Being beyond consolation; deeply dejected and dispirited; hopelessly sad; filled with grief; as, "a bereaved and disconsolate parent.",Inspiring dejection; saddening; cheerless; as, "the disconsolate darkness of the winter nights.",
2004-12-18,germane,Appropriate or fitting; relevant.,
2004-12-17,permeate,To spread or diffuse through.,To pass through the pores or openings of.,To spread through or penetrate something.,
2004-12-16,recherche,Uncommon; exotic; rare.,Exquisite; choice.,Excessively refined; affected.,
2004-12-15,hoi polloi,the common people; the masses (often preceded by the).,
2004-12-14,dulcet,Pleasing to the ear; melodious; harmonious.,Generally pleasing, soothing, or agreeable.,(Archaic) Sweet to the taste.,
2004-12-13,aborning,While being produced or born.,Being produced or born.,
2004-12-12,raiment,Clothing in general; garments; -- usually singular in form, with a collective sense.,
2004-12-11,forgo,To abstain from; to do without.,
2004-12-10,extemporaneous,Composed, performed, or uttered on the spur of the moment, or without previous study; unpremeditated; impromptu.,Prepared beforehand but delivered without notes or text.,Skilled at or given to extemporaneous speech.,
2004-12-09,solecism,A breach of good manners or etiquette.,A nonstandard or ungrammatical usage, as unflammable and they was.,Any error, impropriety, or inconsistency.,
2004-12-08,perfervid,Ardent; impassioned; marked by exaggerated or overwrought emotion.,
2004-12-07,demur,To object; to take exception.,To delay.,The act of demurring.,
2004-12-06,genuflect,To bend the knee or touch one knee to the ground, as in worship.,To be servilely respectful or obedient; to grovel.,
2004-12-05,exhort,To incite by words or advice; to urge strongly; hence, to advise, warn, or caution.,To make urgent appeal; to give warning or advice.,
2004-12-04,cadre,A core or nucleus of trained or otherwise qualified personnel around which an organization is formed.,A tightly knit and trained group of dedicated members active in promoting the interests of a revolutionary party.,A member of such a group.,
2004-12-03,malversation,Misconduct, corruption, or extortion in public office.,
2004-12-02,empyrean,The highest heaven, in ancient belief usually thought to be a realm of pure fire or light.,Heaven; paradise.,The heavens; the sky.,
2004-12-01,ne plus ultra,The highest point, as of excellence or achievement; the acme; the pinnacle; the ultimate.,The most profound degree of a quality or condition.,
2004-11-30,contretemps,an inopportune occurrence; an embarrassing mischance: He caused a minor contretemps by knocking over his drink.,
2004-11-29,Promethean,Of or pertaining to Prometheus.,Boldly original or creative.,
2004-11-28,cajole,To persuade with flattery, repeated appeals, or soothing words; to coax.,
2004-11-27,egregious,Conspicuously and outrageously bad or reprehensible.,
2004-11-26,pastiche,A work of art that imitates the style of some previous work.,A musical, literary, or artistic composition consisting of selections from various works.,A hodgepodge; an incongruous combination of different styles and ingredients.,
2004-11-25,cormorant,Any species of Phalacrocorax, a genus of sea birds having a sac under the beak; the shag. Cormorants devour fish voraciously, and have become the emblem of gluttony. They are generally black, and hence are called sea ravens, and coalgeese.,A gluttonous, greedy, or rapacious person.,
2004-11-24,tattoo,A rapid, rhythmic drumming or rapping.,A beat of a drum, or sound of a trumpet or bugle, giving notice to soldiers to go to their quarters at night.,A display of military exercises given as evening entertainment.,
2004-11-23,panjandrum,a self-important or pretentious official.,
2004-11-22,disquisition,A formal discourse on a subject.,
2004-11-21,sagacious,Having or showing keen discernment, sound judgment, and farsightedness.,
2004-11-20,prink,to fuss over one's dress, especially before the mirror.,to deck oneself out.,to deck or dress for show.,
2004-11-19,denouement,The final resolution of the main complication of a literary or dramatic work.,The outcome of a complex sequence of events.,
2004-11-18,clerisy,The well educated class; the intelligentsia.,
2004-11-17,supplant,To take the place of (another), especially through intrigue or underhanded tactics; as, a rival supplants another.,To take the place of and serve as a substitute for.,
2004-11-16,louche,Of questionable taste or morality; disreputable or indecent; dubious; shady.,
2004-11-15,chortle,To utter, or express with, a snorting, exultant laugh or chuckle.,A snorting, exultant laugh or chuckle.,
2004-11-14,intrepid,Fearless; bold; brave; undaunted; courageous; as, an intrepid soldier; intrepid spirit.,
2004-11-13,discomfit,To make uneasy or perplexed, or to put into a state of embarrassment; to disconcert; to upset.,To thwart; to frustrate the plans of.,(Archaic). To defeat in battle.,
2004-11-12,propitiate,To render favorably inclined; to appease; to conciliate (one offended).,
2004-11-11,turbid,Muddy; thick with or as if with roiled sediment; not clear; -- used of liquids of any kind.,Thick; dense; dark; -- used of clouds, air, fog, smoke, etc.,Disturbed; confused; disordered.,
2004-11-10,ribald,Characterized by or given to vulgar humor; coarse.,A ribald person; a lewd fellow.,
2004-11-09,gadabout,Someone who roams about in search of amusement or social activity.,
2004-11-08,fallible,Liable to make a mistake.,Liable to be inaccurate or erroneous.,
2004-11-07,arriviste,A person who has recently attained success, wealth, or high status but not general acceptance or respect; an upstart.,
2004-11-06,effrontery,Insulting presumptuousness; shameless boldness; insolence.,
2004-11-05,obsequious,Servilely attentive; compliant to excess; fawning.,
2004-11-04,imprecation,The act of imprecating, or invoking evil upon someone.,A curse.,
2004-11-03,redolent,Having or exuding fragrance; scented; aromatic.,Full of fragrance; odorous; smelling (usually used with 'of' or 'with').,Serving to bring to mind; evocative; suggestive; reminiscent (usually used with 'of' or 'with').,
2004-11-02,jejune,without interest or significance; dull; insipid: a jejune novel.,juvenile; immature; childish: jejune behavior.,lacking knowledge or experience; uninformed: jejune attempts to design a house.,
2004-11-01,debouch,To march out (as from a wood, defile, or other narrow or confined spot) into the open.,To emerge; to issue.,To cause to emerge or issue; to discharge.,
2004-10-31,diablerie,Sorcery; black magic; witchcraft.,Representation of devils or demons in words or pictures.,Mischievous conduct; deviltry.,
2004-10-30,inexorable,Not to be persuaded or moved by entreaty or prayer; firm; determined; unyielding; unchangeable; inflexible; relentless.,
2004-10-29,cavort,to prance or caper about.,to behave in a high-spirited, festive manner; make merry.,
2004-10-28,foundling,A deserted or abandoned infant; a child found without a parent or caretaker.,
2004-10-27,hoary,Tedious from familiarity; stale.,Gray or white with age.,Ancient or venerable.,
2004-10-26,rodomontade,vainglorious boasting or bragging; pretentious, blustering talk.,bragging.,to boast; brag; talk big.,
2004-10-25,heterogeneous,Consisting of dissimilar elements, parts, or ingredients -- opposed to homogeneous.,
2004-10-24,acerbic,Sharp, biting, or acid in temper, expression, or tone.,
2004-10-23,caterwaul,To make a harsh cry.,To have a noisy argument.,A shrill, discordant sound.,
2004-10-22,fecund,Capable of producing offspring or vegetation; fruitful; prolific.,Intellectually productive or inventive.,
2004-10-21,vatic,Of or characteristic of a prophet or prophecy; prophetic; oracular.,
2004-10-20,popinjay,A vain and talkative person.,
2004-10-19,corpulent,Very fat; obese.,
2004-10-18,maunder,To talk incoherently; to speak in a rambling manner.,To wander aimlessly or confusedly.,
2004-10-17,convivial,Fond of feasting, drinking, and good company; sociable.,Merry; festive.,
2004-10-16,undulant,Resembling waves in form, motion, or occurrence.,
2004-10-15,prima facie,At first view; on the first appearance.,True, valid, or adequate at first sight; as it seems at first sight; ostensible.,Self-evident; obvious.,
2004-10-14,affray,A tumultuous assault or quarrel; a brawl.,
2004-10-13,obeisance,An expression of deference or respect, such as a bow or curtsy.,Deference, homage.,
2004-10-12,effusive,Excessively demonstrative; giving or involving extravagant or excessive emotional expression; gushing.,
2004-10-11,indigence,A state of extreme poverty or destitution.,
2004-10-10,egress,The act of going out or leaving, or the right or freedom to leave; departure.,A means of going out or leaving; an exit; an outlet.,To go out; to depart; to leave.,
2004-10-09,cohort,A group or band of people.,A companion; an associate.,A group of people sharing a common statistical factor (as age or membership in a class) in a demographic study.,
2004-10-08,histrionic,Of or relating to actors, acting, or the theater; befitting a theater; theatrical.,Overly dramatic; deliberately affected.,
2004-10-07,tremulous,(of persons, the body, etc.) characterized by trembling, as from fear, nervousness, or weakness.,timid; timorous; fearful.,(of things) vibratory, shaking, or quivering.,
2004-10-06,rapprochement,The establishment or state of cordial relations.,
2004-10-05,didactic,Fitted or intended to teach; conveying instruction; instructive; teaching some moral lesson; as, "didactic essays.",Inclined to teach or moralize excessively; moralistic.,
2004-10-04,abulia,Loss or impairment of the ability to act or to make decisions.,
2004-10-03,cudgel,A short heavy stick used as a weapon; a club.,To beat with or as if with a cudgel.,
2004-10-02,acclimate,To accustom or become accustomed to a new climate, environment, or situation.,
2004-10-01,enunciate,To utter articulately; to pronounce.,To state or set forth precisely or systematically.,To announce; to proclaim; to declare.,
2004-09-30,ignoble,Of low birth or family; not noble; not illustrious; plebeian; common; humble.,Not noble in quality, character, or purpose; characterized by baseness, lowness, or meanness.,
2004-09-29,harangue,A speech addressed to a large public assembly.,A noisy or pompous speech; a rant.,To deliver a harangue to; to address by a harangue.,
2004-09-28,credulous,Ready or inclined to believe on slight or uncertain evidence.,Based on or proceeding from a disposition to believe too readily.,
2004-09-27,excursus,A dissertation that is appended to a work and that contains a more extended exposition of some important point or topic.,A digression.,
2004-09-26,cacophony,Harsh or discordant sound; dissonance.,The use of harsh or discordant sounds in literary composition.,
2004-09-25,wiseacre,One who pretends to knowledge or cleverness; a would-be wise person; a smart aleck.,
2004-09-24,quash,(Law) To abate, annul, overthrow, or make void; as, "to quash an indictment.",To crush; to subdue; to suppress or extinguish summarily and completely; as, "to quash a rebellion.",
2004-09-23,inkhorn,Affectedly or ostentatiously learned; pedantic.,A small bottle of horn or other material formerly used for holding ink.,
2004-09-22,confabulation,Familiar talk; easy, unrestrained, unceremonious conversation.,(Psychology) A plausible but imagined memory that fills in gaps in what is remembered.,
2004-09-21,tatterdemalion,ragged; unkempt or dilapidated.,a person in tattered clothing; a shabby person.,
2004-09-20,fatidic,Of, relating to, or characterized by prophecy; prophetic.,
2004-09-19,calumny,False accusation of a crime or offense, intended to injure another's reputation.,Malicious misrepresentation; slander.,
2004-09-18,machination,The act of plotting.,A crafty scheme; a cunning design or plot intended to accomplish some usually evil end.,
2004-09-17,avoirdupois,Avoirdupois weight, a system of weights based on a pound containing 16 ounces or 7,000 grains (453.59 grams).,Weight; heaviness; as, a person of much avoirdupois.,
2004-09-16,chimera,(Capitalized) A fire-breathing she-monster represented as having a lion's head, a goat's body, and a serpent's tail.,Any imaginary monster made up of grotesquely incongruous parts.,An illusion or mental fabrication; a grotesque product of the imagination.,
2004-09-15,rivulet,A small stream or brook; a streamlet.,
2004-09-14,longueur,A dull and tedious passage in a book, play, musical composition, or the like.,
2004-09-13,appellation,The word by which a particular person or thing is called and known; name; title; designation.,The act of naming.,
2004-09-12,disport,To amuse oneself in light or lively manner; to frolic.,To divert or amuse.,To display.,
2004-09-11,indefatigable,incapable of being tired out; not yielding to fatigue; untiring.,
2004-09-10,wizened,Dried; shriveled; withered; shrunken; as, "a wizened old man.",
2004-09-09,adage,An old saying, which has obtained credit by long use; a proverb.,
2004-09-08,skulduggery,dishonorable proceedings; mean dishonesty or trickery: bribery, graft, and other such skulduggery.,an instance of dishonest or deceitful behavior; trick.,
2004-09-07,epicene,Having the characteristics of both sexes.,Effeminate; unmasculine.,Sexless; neuter.,
2004-09-06,pied-a-terre,A temporary or second place of lodging.,
2004-09-05,malodorous,Having a bad odor.,
2004-09-04,bricolage,Construction or something constructed by using whatever materials happen to be available.,
2004-09-03,myriad,Consisting of a very great, but indefinite, number; as, myriad stars.,Composed of numerous diverse elements or aspects.,The number of ten thousand; ten thousand persons or things. (Chiefly in reference to the Greek numeral system, or in translations from Greek or Latin).,
2004-09-02,plenipotentiary,Containing or conferring full power; invested with full power; as, "plenipotentiary license; plenipotentiary ministers.",A person invested with full power to transact any business; especially, an ambassador or diplomatic agent with full power to negotiate a treaty or to transact other business.,
2004-09-01,dolorous,Marked by, causing, or expressing grief or sorrow.,
2004-08-31,sere,Dry; withered.,
2004-08-30,contrite,Deeply affected with grief and regret for having done wrong; penitent; as, "a contrite sinner.",Expressing or arising from contrition; as, "contrite words.",
2004-08-29,copse,A thicket of small trees or bushes; a small wood.,
2004-08-28,bon vivant,A person with refined and sociable tastes, especially one who enjoys fine food and drink.,
2004-08-27,Methuselah,The name of a biblical patriarch said to have lived 969 years.,An extremely old man.,
2004-08-26,eddy,A current of air or water running in a direction contrary to the main current, or moving in a circular direction; a whirlpool.,A tendency or current (as of opinion or history) contrary to or separate from a main current.,To move in an eddy or as if in an eddy; to move in a circle.,
2004-08-25,nimbus,(Fine Arts) A circle, or disk, or any indication of radiant light around the heads of divinities, saints, and sovereigns, upon medals, pictures, etc.; a halo.,A cloud or atmosphere (as of romance or glamour) that surrounds a person or thing.,(Meteorology) A rain cloud.,
2004-08-24,fungible,(Law) Freely exchangeable for or replaceable by another of like nature or kind in the satisfaction of an obligation.,Interchangeable.,Something that is exchangeable or substitutable. Usually used in the plural.,
2004-08-23,amicable,Characterized by friendliness and good will; friendly; peaceable.,
2004-08-22,excrescence,Something (especially something abnormal) growing out from something else.,A disfiguring or unwanted mark, part, or addition.,
2004-08-21,verbose,Abounding in words; using or containing more words than are necessary; tedious by an excess of words; wordy; as, "a verbose speaker; a verbose argument.",
2004-08-20,punctilio,A fine point of exactness in conduct, ceremony, or procedure.,Strictness or exactness in the observance of formalities; as, "the punctilios of a public ceremony.",
2004-08-19,imprimatur,Official license or approval to print or publish a book, paper, etc.; especially, such a license issued by the Roman Catholic episcopal authority.,Approval; sanction.,A mark of approval or distinction.,
2004-08-18,Cockaigne,An imaginary land of ease and luxury.,
2004-08-17,foofaraw,a great fuss or disturbance about something very insignificant.,an excessive amount of decoration or ornamentation, as on a piece of clothing, a building, etc.,
2004-08-16,pervicacious,Refusing to change one's ideas, behavior, etc.; stubborn; obstinate.,
2004-08-15,abominate,To hate in the highest degree; to detest intensely; to loathe; to abhor.,
2004-08-14,countervail,To act against with equal force, power, or effect; to counteract.,To compensate for; to offset; to furnish or serve as an equivalent to.,To exert force against an opposing, often bad, influence or power.,
2004-08-13,presentiment,A sense that something will or is about to happen; a premonition.,
2004-08-12,flaneur,One who strolls about aimlessly; a lounger; a loafer.,
2004-08-11,arcanum,A secret; a mystery.,Specialized or mysterious knowledge, language, or information that is not accessible to the average person (generally used in the plural).,
2004-08-10,senescent,Growing old; aging.,
2004-08-09,gamine,A girl who wanders about the streets; an urchin.,A playfully mischievous girl or young woman.,
2004-08-08,efface,To cause to disappear by rubbing out, striking out, etc.; to erase; to render illegible or indiscernible.,To destroy, as a mental impression; to wipe out; to eliminate completely.,To make (oneself) inconspicuous.,
2004-08-07,nonpareil,Having no equal; peerless.,Something of unequaled excellence; a peerless thing or person.,A flat disk of chocolate covered with beads of colored sugar.,
2004-08-06,sui generis,Being the only example of its kind; constituting a class of its own; unique.,
2004-08-05,bloviate,To speak or write at length in a pompous or boastful manner.,
2004-08-04,conflate,To bring together; to fuse together; to join or meld.,To combine (as two readings of a text) into one whole.,
2004-08-03,providential,Of or resulting from divine direction or superintendence.,Occurring through or as if through divine intervention; peculiarly fortunate or appropriate.,
2004-08-02,fructuous,Fruitful; productive.,
2004-08-01,apotheosis,Elevation to divine rank or stature; deification.,An exalted or glorified example; a model of excellence or perfection of a kind.,
2004-07-31,megrim,A migraine.,A fancy; a whim.,In the plural: lowness of spirits -- often with 'the'.,
2004-07-30,lapidary,Of or pertaining to the art of cutting stones or engraving on them.,Engraved in stone.,Of or pertaining to the refined or terse style associated with inscriptions on monumental stone.,
2004-07-29,ensorcell,To enchant; to bewitch.,
2004-07-28,aerie,The bird's nest built on a lofty place, such as a cliff or mountaintop.,A dwelling or stronghold located in a lofty place.,
2004-07-27,roborant,Strengthening; restoring vigor.,A strengthening medicine; a tonic; a restorative.,
2004-07-26,incarnadine,Having a fleshy pink color.,Red; blood-red.,To make red or crimson.,
2004-07-25,beau ideal,A perfect or an idealized type or model.,
2004-07-24,sciolism,Superficial knowledge; a superficial show of learning.,
2004-07-23,treacly,Like, or composed of, treacle.,Overly sweet or sentimental.,
2004-07-22,eructation,The act of belching; a belch.,
2004-07-21,draconian,Pertaining to Draco, a lawgiver of Athens, 621 B.C.,Excessively harsh; severe.,
2004-07-20,hypnagogic,of or relating to drowsiness.,inducing drowsiness.,
2004-07-19,ineffectual,Not producing the proper effect; without effect; weak; useless; futile; unavailing.,
2004-07-18,entreat,To make an earnest petition or request; to plead.,To ask earnestly; to beseech; to petition for.,
2004-07-17,pandemic,Affecting a whole people or a number of countries; everywhere epidemic.,A pandemic disease.,
2004-07-16,salient,Shooting out or up; projecting.,Forcing itself on the attention; prominent; conspicuous; noticeable.,Leaping; springing; jumping.,
2004-07-15,acuity,Acuteness of perception or vision; sharpness.,
2004-07-14,libation,The act of pouring a liquid (usually wine) either on the ground or on a victim in sacrifice to some deity; also, the wine or liquid thus poured out.,A beverage, especially an alcoholic beverage.,An act or instance of drinking.,
2004-07-13,supernal,Being in or coming from the heavens or a higher place or region.,Relating or belonging to things above; celestial; heavenly.,Lofty; of surpassing excellence.,
2004-07-12,remunerate,To pay an equivalent to for any service, loss, or expense; to recompense.,To compensate for; to make payment for.,
2004-07-11,acrimony,Bitter, harsh, or biting sharpness, as of language, disposition, or manners.,
2004-07-10,overweening,Overbearing; arrogant; presumptuous.,Excessive; immoderate; exaggerated.,
2004-07-09,flummery,A name given to various sweet dishes made with milk, eggs, flour, etc.,Empty compliment; unsubstantial talk or writing; mumbo jumbo; nonsense.,
2004-07-08,teetotaler,One pledged to entire abstinence from all intoxicating drinks.,
2004-07-07,errant,Wandering; roving, especially in search of adventure.,Deviating from an appointed course; straying.,Straying from the proper standards (as of truth or propriety).,
2004-07-06,congeries,A collection; an aggregation.,
2004-07-05,refractory,Stubbornly disobedient; unmanageable.,Resisting ordinary treatment or cure.,Difficult to melt or work; capable of enduring high temperature.,
2004-07-04,ludic,playful in an aimless way: the ludic behavior of kittens.,
2004-07-03,collegial,Characterized by or having authority or responsibility shared equally by each of a group of colleagues.,Characterized by equal sharing of authority especially by Roman Catholic bishops.,Of or relating to a college or university; collegiate.,
2004-07-02,agon,A struggle or contest; conflict; especially between the protagonist and antagonist in a literary work.,
2004-07-01,tete-a-tete,Private; confidential; familiar.,A private conversation between two people.,A short sofa intended to accommodate two persons.,
2004-06-30,misprize,To hold in contempt.,To undervalue.,
2004-06-29,quisling,Someone who collaborates with an enemy occupying his or her country; a traitor.,
2004-06-28,nolens volens,Whether unwilling or willing.,
2004-06-27,peccant,Sinning; guilty of transgression.,Violating a rule or a principle.,
2004-06-26,woolgathering,Indulgence in idle daydreaming.,
2004-06-25,ab ovo,From the beginning.,
2004-06-24,pin money,An allowance of money given by a husband to his wife for private and personal expenditures.,Money for incidental expenses.,A trivial sum.,
2004-06-23,delectation,Great pleasure; delight, enjoyment.,
2004-06-22,jeremiad,a prolonged lamentation or mournful complaint.,
2004-06-21,deipnosophist,a person who is an adept conversationalist at table.,
2004-06-20,yeasty,Of, pertaining to, or resembling yeast.,Not yet settled or formed; immature or incomplete.,Marked by agitation or change.,
2004-06-19,trenchant,Characterized by or full of force and vigor; as, "a trenchant analysis.",Caustic; biting; severe; as, "trenchant criticism.",Distinct; clear-cut; clearly or sharply defined.,
2004-06-18,favonian,of or pertaining to the west wind.,mild or favorable; propitious.,
2004-06-17,Potemkin village,An impressive facade or display that hides an undesirable fact or state; a false front.,
2004-06-16,ancillary,Subordinate; subsidiary.,Auxiliary; helping.,Something that is subordinate to something else.,
2004-06-15,primogeniture,The state of being the firstborn of the same parents; seniority by birth among children of the same family.,(Law) An exclusive right of inheritance that belongs to the eldest son.,
2004-06-14,equanimity,mental or emotional stability or composure, especially under tension or strain; calmness; equilibrium.,
2004-06-13,bedizen,To dress or adorn in gaudy manner.,
2004-06-12,sonorous,Giving sound when struck; resonant; as, sonorous metals.,Loud-sounding; giving a clear or loud sound; as, a sonorous voice.,Yielding sound; characterized by sound; as, the vowels are sonorous.,
2004-06-11,recumbent,Reclining; lying down.,Resting; inactive; idle.,
2004-06-10,homily,A sermon; a discourse on a religious theme.,A moralizing lecture or discourse.,An inspirational saying; also, a platitude.,
